{
  "schemaVersion": 1,
  "id": "REQ_LK_TOURIST_ONLINE_001",
  "countryId": "COUNTRY_LK_001",
  "countryCode": "LK",
  "visaTypeId": "VISA_LK_TOURIST_001",
  "visaTypeCode": "TOURIST",
  "locationId": "ONLINE",
  "visaVariantId": "VISA_LK_TOURIST_ONLINE_001",
  "locationCode": "ONLINE",
  "processingDays": "4 business days",
  "processingDaysExpress": "2 business days (Emergency) / 1 business day (Rush)",
  "photoSpecifications": {
    "portrait": {
      "widthMm": 35,
      "heightMm": 45,
      "background": "Plain white background",
      "colorFormat": "Colored",
      "faceVisibilityPercent": "70-80",
      "quality": "Recent color photograph, clear face, white background, no headwear unless for religious purposes",
      "maxAgeMonths": 6,
      "requirements": [
        "Format must be JPG or JPEG (size < 2MB)",
        "White background",
        "Clear face, no spectacles or glasses"
      ]
    }
  },
  "documentSections": [
    {
      "sectionId": "COMMON",
      "title": "ETA Application Documents",
      "documents": [
        {
          "order": 1,
          "id": "LK_TOURIST_EVISA_FORM_001",
          "code": "VISA_APPLICATION_FORM",
          "name": "ETA Application Form",
          "isRequired": true,
          "optionality": "required",
          "form": {
            "type": "ONLINE",
            "downloadUrl": null,
            "onlineUrl": "https://eta.gov.lk/etaslvisa/etaNavServ",
            "requiresPrint": false,
            "formFillDataKey": "LK_TOURIST_EVISA_FORM_FIELDS_V1"
          },
          "notes": "Fill out the official online ETA application form. Use our Form Fill Helper below for step-by-step guidance."
        },
        {
          "order": 2,
          "id": "LK_TOURIST_PASSPORT_SCAN_001",
          "code": "PASSPORT_SCAN",
          "name": "Passport Bio Page Scan",
          "isRequired": true,
          "optionality": "required",
          "notes": "Upload a clear, full scan of your passport's bio-data page in JPG/JPEG format.",
          "acceptedFormats": ["jpg", "jpeg"],
          "maxSizeBytes": 2097152,
          "requirements": [
            "Must show the full page including MRZ code at the bottom.",
            "Format must be JPG/JPEG (less than 2MB).",
            "Passport must be valid for at least 6 months from arrival date with at least 3 blank pages."
          ]
        },
        {
          "order": 3,
          "id": "LK_TOURIST_PORTRAIT_001",
          "code": "PORTRAIT_PHOTO",
          "name": "Recent Portrait Photo",
          "isRequired": true,
          "optionality": "required",
          "notes": "Upload a recent color photograph with white background.",
          "photoSpecRef": "portrait",
          "acceptedFormats": ["jpg", "jpeg"],
          "maxSizeBytes": 2097152
        },
        {
          "order": 4,
          "id": "LK_TOURIST_RETURN_TICKET_001",
          "code": "RETURN_TICKET",
          "name": "Confirmed Return Ticket",
          "isRequired": true,
          "optionality": "required",
          "notes": "Prepare a confirmed return ticket or onward journey ticket.",
          "requirements": [
            "Must be a confirmed return or onward ticket to another destination."
          ]
        },
        {
          "order": 5,
          "id": "LK_TOURIST_SUFFICIENT_FUNDS_001",
          "code": "SUFFICIENT_FUNDS",
          "name": "Proof of Sufficient Funds",
          "isRequired": true,
          "optionality": "required",
          "notes": "Prepare proof of sufficient funds to meet the expenses during the stay (this might be needed at the port of entry).",
          "requirements": [
            "Can include cash, credit card statements, or traveler's cheques to cover expenses during the stay."
          ]
        }
      ]
    }
  ],
  "importantNotes": [
    "Government fee is waived (0 USD) for 30 days for tourist visa.",
    "The ETA is initially limited up to 30 days from the date of arrival and it can be extended up to six months (see: https://www.immigrationlanka.com/Info-2-15.html?locale=en_US).",
    "Make sure all details match your passport exactly. Incorrect details will lead to boarding rejection or entry denial.",
    "A Yellow Fever vaccination certificate is required if you are arriving from a Yellow Fever infected area."
  ],
  "metadata": {
    "sourceUrl": "https://eta.gov.lk/etaslvisa/etaNavServ",
    "lastVerified": "2026-05-27",
    "verifiedBy": "admin",
    "status": "verified",
    "dataCollectionDate": "2026-05-27"
  }
}
