{
  "schemaVersion": 1,
  "id": "REQ_LK_BUSINESS_ONLINE_001",
  "countryId": "COUNTRY_LK_001",
  "countryCode": "LK",
  "visaTypeId": "VISA_LK_BUSINESS_001",
  "visaTypeCode": "BUSINESS",
  "locationId": "ONLINE",
  "visaVariantId": "VISA_LK_BUSINESS_ONLINE_001",
  "locationCode": "ONLINE",
  "processingDays": "4 business days",
  "processingDaysExpress": "2 business days (Emergency) / 1 business day (Rush)",
  "documentSections": [
    {
      "sectionId": "COMMON",
      "title": "ETA Application Documents",
      "documents": [
        {
          "order": 1,
          "id": "LK_BUSINESS_EVISA_FORM_001",
          "code": "VISA_APPLICATION_FORM",
          "name": "ETA Application Form",
          "isRequired": true,
          "optionality": "required",
          "form": {
            "type": "ONLINE",
            "downloadUrl": null,
            "onlineUrl": "https://eta.gov.lk/etaslvisa/etaNavServ",
            "requiresPrint": false,
            "formFillDataKey": "LK_BUSINESS_EVISA_FORM_FIELDS_V1"
          },
          "notes": "Fill out the official online ETA application form. Use our Form Fill Helper below for step-by-step guidance."
        },
        {
          "order": 2,
          "id": "LK_BUSINESS_PASSPORT_SCAN_001",
          "code": "PASSPORT_SCAN",
          "name": "Passport Bio Page Scan",
          "isRequired": true,
          "optionality": "required",
          "notes": "Upload a clear, full scan of your passport's bio-data page in JPG/JPEG format.",
          "acceptedFormats": ["jpg", "jpeg"],
          "maxSizeBytes": 2097152,
          "requirements": [
            "Must show the full page including MRZ code at the bottom.",
            "Format must be JPG/JPEG (less than 2MB).",
            "Passport must be valid for at least 6 months from arrival date with at least 3 blank pages."
          ]
        },
        {
          "order": 4,
          "id": "LK_BUSINESS_INVITATION_LETTER_001",
          "code": "INVITATION_LETTER",
          "name": "Business Invitation Letter",
          "isRequired": true,
          "optionality": "required",
          "notes": "Upload an invitation letter from the host company or organization in Sri Lanka.",
          "acceptedFormats": ["pdf", "jpg", "jpeg"],
          "maxSizeBytes": 5242880,
          "requirements": [
            "Must be on the host company's official letterhead.",
            "Must state the purpose and duration of the visit.",
            "Must be signed by an authorized representative of the company."
          ]
        },
        {
          "order": 5,
          "id": "LK_BUSINESS_RETURN_TICKET_001",
          "code": "RETURN_TICKET",
          "name": "Confirmed Return Ticket",
          "isRequired": true,
          "optionality": "required",
          "notes": "Prepare a confirmed return ticket or onward journey ticket.",
          "requirements": [
            "Must be a confirmed return or onward ticket to another destination."
          ]
        },
        {
          "order": 6,
          "id": "LK_BUSINESS_SUFFICIENT_FUNDS_001",
          "code": "SUFFICIENT_FUNDS",
          "name": "Proof of Sufficient Funds",
          "isRequired": true,
          "optionality": "required",
          "notes": "Prepare proof of sufficient funds to meet the expenses during the stay (this might be needed at the port of entry).",
          "requirements": [
            "Can include cash, credit card statements, or traveler's cheques to cover expenses during the stay."
          ]
        }
      ]
    }
  ],
  "importantNotes": [
    "Government fee is 30 USD for SAARC (including Indian) nationals.",
    "Business ETA is valid for 6 months from date of issue, with multiple entries allowed. The stay is limited to 30 days per entry.",
    "Ensure all details match your passport exactly. Typos will lead to visa rejection."
  ],
  "metadata": {
    "sourceUrl": "https://eta.gov.lk/etaslvisa/etaNavServ",
    "lastVerified": "2026-05-27",
    "verifiedBy": "admin",
    "status": "verified",
    "dataCollectionDate": "2026-05-27"
  }
}
